"8QAWEM2V","journalArticle","2012","Greller, Wolfgang; Drachsler, Hendrik","Translating Learning into Numbers: A Generic Framework for Learning Analytics","Journal of Educational Technology & Society","","1176-3647","","http://www.jstor.org/stable/jeductechsoci.15.3.42","ABSTRACT With the increase in available educational data, it is expected that Learning Analytics will become a powerful means to inform and support learners, teachers and their institutions in better understanding and predicting personal learning needs and performance. However, the processes and requirements behind the beneficial application of Learning and Knowledge Analytics as well as the consequences for learning and teaching are still far from being understood. In this paper, we explore the key dimensions of Learning Analytics (LA), the critical problem zones, and some potential dangers to the beneficial exploitation of educational data. We propose and discuss a generic design framework that can act as a useful guide for setting up Learning Analytics services in support of educational practice and learner guidance, in quality assurance, curriculum development, and in improving teacher effectiveness and efficiency. Furthermore, the presented article intends to inform about soft barriers and limitations of Learning Analytics. We identify the required skills and competences that make meaningful use of Learning Analytics data possible to overcome gaps in interpretation literacy among educational stakeholders. We also discuss privacy and ethical issues and suggest ways in which these issues can be addressed through policy guidelines and best practice examples.","2012","2016-09-13 16:13:41","2016-09-13 16:13:41","2016-09-03 18:55:41","42-57","","3","15","","Journal of Educational Technology & Society","Translating Learning into Numbers","","","","","","","","","","","","JSTOR","","","<ul> <li> <h2>It is a framework informing us how to do LA correctly in six dimensions</h2> </li> </ul> <h2><!--StartFragment--></h2> <ul> <li> <h2>Why do people are fear about educational data?</h2> </li> </ul> <ul> <li> <h2>Education tracking based on student performance</h2> </li> </ul> <ul> <li> <h2>Predestination</h2> </li> </ul> <ul> <li> <h2>The ""labelling"" issue</h2> </li> <li> <h2>six dimensions:</h2> </li> <li> <h2>internal limitations: competences (do the data clients have the necessary competences to interpret and act upon the results?), acceptance</h2> </li> <li> <h2>external constraints:conventions (Privacy: is the analysis in accordance with privacy arrangements, are the students properly informed?), norms (are their legal data protection or IPR issues related to this kind of use of student data?); ethics (what are the dangers of abuse/misguided use of the data? Time scale: will the students still be able to benefit from the analytics outcome? Is the analysis post-hoc or just-in-time?</h2> </li> <li> <h2>Instruments: technology (SNA, STAT), algorithm, theories (Pedagogic theory);</h2> </li> <li> <h2>Objectives: reflection, prediction</h2> </li> <li> <h2>data: open, protected; protected dataset: student interactions and posts in the discussion forum of the LMS; relevant indicators: posts published, posts replied to</h2> </li> <li> <h2>stakeholders: institution, teachers, learners, other</h2> </li> <li> <h2>Educational data publicly available: dataTEL challenge, dataTEL worshop, PSLC dataShop, LinkedEducation.org</h2> </li> </ul> <p><!--EndFragment--></p>","","","","","","","","","","","","","","","","","","","","","","","","","","","","","","","","","","","","","","","","","","","","","","","","","",""
"547MZ7C9","bookSection","2006","Kay, Judy; Maisonneuve, Nicolas; Yacef, Kalina; Reimann, Peter","The Big Five and Visualisations of Team Work Activity","Intelligent Tutoring Systems","978-3-540-35159-7 978-3-540-35160-3","","","http://link.springer.com/chapter/10.1007/11774303_20","We have created a set of novel visualisations of group activity: they mirror activity of individuals and their interactions, based upon readily available authentic data. We evaluated these visualisations in the context of a semester long software development project course. We give a theoretical analysis of the design of our visualizations using the framework from the “Big 5” theory of team work as well as a qualitative study of the visualisations and the students’ reflective reports. We conclude that these visualisations provide a powerful and valuable mirroring role with potential, when well used, to help groups learn to improve their effectiveness.","2006-06-26","2016-09-13 16:13:41","2016-09-13 16:13:41","2016-09-03 19:10:12","197-206","","","","","","","","","","","Springer Berlin Heidelberg","","en","©2006 Springer-Verlag Berlin Heidelberg","","","","link.springer.com","","","<h2>Useful visualizations</h2> <h2>that can mirror activity of individuals and their interactions, based on the authentic data.</h2> <h2>Different types of visualizations actually provide powerful and valuable mirroring role. They help groups learn to improve their effectiveness.</h2> <h2>“Big Five” components of teamwork:</h2> <h2>team leadership, mutual performance monitoring, backup behavior, adaptability, team orientations</h2> <h2>How well do visualizations capture information relevant in the context of the ""Big Five"" framework?</h2> <h2>1. Activity Radar</h2> <h2>a person whose dot is in the center has the highest level of participation; while a person whose dot is on the perimeter has the lowest level of participation.</h2> <p><a href=""https://www.youtube.com/watch?v=m-4NbxXllpY"">https://www.youtube.com/watch?v=m-4NbxXllpY</a></p> <p><a href=""https://www.elsevier.com/connect/a-5-step-guide-to-data-visualization"">https://www.elsevier.com/connect/a-5-step-guide-to-data-visualization</a></p> <p>&nbsp;</p> <h2>2. Interaction Network (Social Network Analysis)</h2> <h2>3. Waffle Tree</h2> <p>&nbsp;</p>","","https://link.springer.com/chapter/10.1007/11774303_20","","Artificial Intelligence (incl. Robotics); Computers and Education; Information Systems Applications (incl. Internet); Multimedia Information Systems; User Interfaces and Human Computer Interaction","Ikeda, Mitsuru; Ashley, Kevin D.; Chan, Tak-Wai","","","","","","","","","","","","","","","","","","","","","","","","","","","","","","","","","","","","","","","","","","","","",""
"WJQVMMTR","journalArticle","2015","Konstan, Joseph A.; Walker, J. D.; Brooks, D. Christopher; Brown, Keith; Ekstrand, Michael D.","Teaching Recommender Systems at Large Scale: Evaluation and Lessons Learned from a Hybrid MOOC","ACM Trans. Comput.-Hum. Interact.","","1073-0516","10.1145/2728171","http://doi.acm.org/10.1145/2728171","","2015-04","2016-09-13 16:13:41","2016-09-13 16:13:41","2016-09-03 20:38:02","10:1–10:23","","2","22","","","Teaching Recommender Systems at Large Scale","","","","","","","","","","","","ACM Digital Library","","","<ul> <li> <h2>need to read again</h2> </li> <li> <h2>As the goal of offering this course was to experiment with this type of instruction, we performed extensive evaluation including surveys of demographics, self-assessed skills, and learning intent; we also designed a knowledge-assessment tool specifically for the subject matter in this course, administering it before and after the course to measure learning, and again 5 months later to measure retention. We also tracked students through the course, including separating out students enrolled for credit from those enrolled only for the free, open course.</h2> </li> <li> <h2>Students had significant knowledge gains across all levels of prior knowledge and across all demographic categories. The main predictor of knowledge gain was effort expended in the course. Students also had significant knowledge retention after the course. Both of these results are limited to the sample of students who chose to complete our knowledge tests.</h2> </li> <li> <h2>Student completion of the course was hard to predict, with few factors contributing predictive power; the main predictor of completion was intent to complete. Students who chose a concepts-only track with hand exercises achieved the same level of knowledge of recommender systems concepts as those who chose a programming track and its added assignments, though the programming students gained additional programming knowledge.</h2> </li> <li> <h2>Based on the limited data we were able to gather, face-to-face students performed as well as the online-only students or better; they preferred this format to traditional lecture for reasons ranging from pure convenience to the desire to watch videos at a different pace (slower for English language learners; faster for some native English speakers). This article also includes our qualitative observations, lessons learned, and future directions.</h2> </li> </ul>","","","","learning assessment; Massively Online Open Course (MOOC)","","","","","","","","","","","","","","","","","","","","","","","","","","","","","","","","","","","","","","","","","","","","","",""
"VG5ZUWGA","bookSection","2013","Desmarais, Michel C.; Naceur, Rhouma","A Matrix Factorization Method for Mapping Items to Skills and for Enhancing Expert-Based Q-Matrices","Artificial Intelligence in Education","978-3-642-39111-8 978-3-642-39112-5","","","http://link.springer.com/chapter/10.1007/978-3-642-39112-5_45","Uncovering the right skills behind question items is a difficult task. It requires a thorough understanding of the subject matter and of the cognitive factors that determine student performance. The skills definition, and the mapping of item to skills, require the involvement of experts. We investigate means to assist experts for this task by using a data driven, matrix factorization approach. The two mappings of items to skills, the expert on one side and the matrix factorization on the other, are compared in terms of discrepancies, and in terms of their performance when used in a linear model of skills assessment and item outcome prediction. Visual analysis shows a relatively similar pattern between the expert and the factorized mappings, although differences arise. The prediction comparison shows the factorization approach performs slightly better than the original expert Q-matrix, giving supporting evidence to the belief that the factorization mapping is valid. Implications for the use of the factorization to design better item to skills mapping are discussed.","2013-07-09","2016-09-13 16:13:41","2016-09-13 16:13:41","2016-09-03 20:44:11","441-450","","","","","","","","","","","Springer Berlin Heidelberg","","en","©2013 Springer-Verlag Berlin Heidelberg","","","","link.springer.com","","","<p>&nbsp;</p> <ul> <li> <h2>Introduction: Mapping items to latent skills is a notoriously difficult task and intelligent help to alleviate this difficulty would obviously be desirable. Although the complete automation of uncovering the skills behind question items for cognitive engineering purpose is beyond reach in the current state of research, means to help determine the number of skills and the common skills between items is a reasonable endeavour in the mid-term, and significant advances have been made recently. We review the state of the art towards this goal in recent years, and demonstrate how a matrix factorization technique can yield promising results to this end.</h2> </li> <li> <h2>a little bit hard to understand, need to read again</h2> </li> </ul>","","https://link.springer.com/chapter/10.1007/978-3-642-39112-5_45","","alternating least squares matrix factorization; Artificial Intelligence (incl. Robotics); Cognitive modeling; Computers and Education; Educational Technology; Information Systems Applications (incl. Internet); latent skills; Pedagogic Psychology; skills assessment; Student models; User Interfaces and Human Computer Interaction","Lane, H. Chad; Yacef, Kalina; Mostow, Jack; Pavlik, Philip","","","","","","","","","","","","","","","","","","","","","","","","","","","","","","","","","","","","","","","","","","","","",""
"V3V3A2IZ","book","2015","Matsuda, Noboru; Furukawa, Tadanobu; Bier, Norman; Faloutsos, Christos","Machine Beats Experts: Automatic Discovery of Skill Models for Data-Driven Online Course Refinement","","","","","http://eric.ed.gov/?id=ED560513","How can we automatically determine which skills must be mastered for the successful completion of an online course? Large-scale online courses (e.g., MOOCs) often contain a broad range of contents frequently intended to be a semester's worth of materials; this breadth often makes it difficult to articulate an accurate set of skills and knowledge (i.e., a skill model, or the QMatrix). We have developed an innovative method to discover skill models from the data of online courses. Our method assumes that online courses have a pre-defined skill map for which skills are associated with formative assessment items embedded throughout the online course. Our method carefully exploits correlations between various parts of student performance, as well as in the text of assessment items, to build a superior statistical model that even outperforms human experts. To evaluate our method, we compare our method with existing methods (LFA) and human engineered skill models on three Open Learning Initiative (OLI) courses at Carnegie Mellon University. The results show that (1) our method outperforms human-engineered skill models, (2) skill models discovered by our method are interpretable, and (3) our method is remarkably faster than existing methods. These results suggest that our method provides a significant contribution to the evidence-based, iterative refinement of online courses with a promising scalability. [For complete proceedings, see ED560503.]","2015-06","2016-09-13 16:13:41","2016-09-13 16:13:41","2016-09-03 20:48:57","","","","","","","Machine Beats Experts","","","","","International Educational Data Mining Society","","en","","","","","ERIC","","","<ul> <li> <h2>MOOCs</h2> </li> <li> <h2>large-scale online courses such as MOOCs data often contain a broad range of contents intended to be a semester's worth of materials; this breath makes it difficult to articulate an accurate set of skills and knowledge</h2> </li> <li> <h2>the researchers of the paper developed an innovative method to discover skill models from the data of online courses</h2> </li> <li> <h2>the method assumes that online courses have a pre-defined skill map for which skills are associated with formative assessment items embedded throughout the online course</h2> </li> <li> <h2>the model exploits correlations between various parts of student performance, as well as in the text of assessment items, to build a superior statistical model that even outperforms human experts</h2> </li> </ul>","","http://eric.ed.gov/?id=ED560513","","Automation; Comparative Analysis; Correlation; data; Formative Evaluation; models; Online Courses; Skills","","","","","","","","","","","","","","","","","","","","","","","","","","","","","","","","","","","","","","","","","","","","","",""
"HXXA3AZR","conferencePaper","2008","Cortez, Paulo; Silva, Alice Maria Gonçalves","Using data mining to predict secondary school student performance","Proceedings of 5th Annual Future Business Technology Conference","978-90-77381-39-7","","","http://repositorium.sdum.uminho.pt/handle/1822/8024","Although the educational level of the Portuguese population has improved in the last decades, the statistics keep Portugal at Europe’s tail end due to its high student failure rates. In particular, lack of success in the core classes of Mathematics and the Portuguese language is extremely serious. On the other hand, the fields of Business Intelligence (BI)/Data Mining (DM), which aim at extracting high-level knowledge from raw data, offer interesting automated tools that can aid the education domain. The present work intends to approach student achievement in secondary education using BI/DM techniques. Recent real-world data (e.g. student grades, demographic, social and school related features) was collected by using school reports and questionnaires. The two core classes (i.e. Mathematics and Portuguese) were modeled under binary/five-level classification and regression tasks. Also, four DM models (i.e. Decision Trees, Random Forest, Neural Networks and Support Vector Machines) and three input selections (e.g. with and without previous grades) were tested. The results show that a good predictive accuracy can be achieved, provided that the first and/or second school period grades are available. Although student achievement is highly influenced by past evaluations, an explanatory analysis has shown that there are also other relevant features (e.g. number of absences, parent’s job and education, alcohol consumption). As a direct outcome of this research, more efficient student prediction tools can be be developed, improving the quality of education and enhancing school resource management.","2008-04","2016-09-13 16:13:42","2016-09-13 16:13:42","2016-09-04 01:23:19","","","","","","","","","","","","EUROSIS","Porto, Spain","eng","openAccess","","","","repositorium.sdum.uminho.pt","","","<h2>11/8</h2> <h2>The paper is interesting and there are concepts of classification and regression in the machine learning, which are the things we learn today.</h2> <h2>discrete data: is counted, can only take certain values, such as the number of students in a class; the results of rolling 2 dice (usually use classification)</h2> <h2>in the article,</h2> <h2>continuous data: is measured; can take any value within a range, such as a person's height, length, weight and time (usually use regression)</h2> <h2>Questions:</h2> <h2>1. how to interpret the tables in the ""descriptive knowledge"" part?</h2> <h2>2. how to determine the rules in the decision tree?</h2> <h2>&nbsp;</h2>","","http://repositorium.sdum.uminho.pt/handle/1822/8024","","","","","","","","","","","","","","","","","","","","","","","","","","","","","","","","","5th Annual Future Business Technology Conference","","","","","","","","","","","","","","",""
"5AX7APR9","journalArticle","2008","Baker, Ryan S. J. d; Corbett, Albert T.; Roll, Ido; Koedinger, Kenneth R.","Developing a generalizable detector of when students game the system","User Modeling and User-Adapted Interaction","","0924-1868, 1573-1391","10.1007/s11257-007-9045-6","http://link.springer.com/article/10.1007/s11257-007-9045-6","Some students, when working in interactive learning environments, attempt to “game the system”, attempting to succeed in the environment by exploiting properties of the system rather than by learning the material and trying to use that knowledge to answer correctly. In this paper, we present a system that can accurately detect whether a student is gaming the system, within a Cognitive Tutor mathematics curricula. Our detector also distinguishes between two distinct types of gaming which are associated with different learning outcomes. We explore this detector’s generalizability, and find that it transfers successfully to both new students and new tutor lessons.","2008-01-23","2016-09-13 16:13:42","2016-09-13 16:13:42","2016-09-04 01:34:49","287-314","","3","18","","User Model User-Adap Inter","","","","","","","","en","","","","","link.springer.com","","","","","https://link.springer.com/article/10.1007/s11257-007-9045-6","","","","","","","","","","","","","","","","","","","","","","","","","","","","","","","","","","","","","","","","","","","","","","","",""
"PR32JEE4","book","2014","Baker, R","Big Data in Education","","","","","","","2014","2016-09-13 16:13:42","2016-09-13 16:13:42","","","","","","","","","","","","","","New York, NY","","","","","","","","","","","","","","","","","","","","","","","","","","","","","","","","","1","","","","","","","","","","","","","","","","","","","","","","","","","",""
"4RU93TQ5","videoRecording","2016","Georgia Tech","Cross Validation","","","","","https://www.youtube.com/watch?v=sFO2ff-gTh0","","2016-09-09","2016-09-13 16:13:42","2016-09-13 16:13:42","2016-09-09 19:37:11","","","","","","","","","","","","Youtube","","","","","","","","","","<ul> <li> <h2>Cross Validation</h2> </li> <li> <h2>find a way of predicting value in a testing set</h2> </li> <li> <h2>the goal is to generalize</h2> </li> <li> <h2>""overfitting"": not we can generalize in the real world</h2> </li> <li> <h2>the testing data is supposed to be representative</h2> </li> <li> <h2>the data comes from the same source: independent and identically distributed (fundamental assumption)</h2> </li> <li> <h2>Use a model that is complex enough to fit the data without causing problems on the test set</h2> </li> <li> <h2>put training data into 4 folds, train on the 1,2,3 fold, then check on the 4th fold; train on the 2rd, 3rd, 4th fold, then check the 1st set; train on the 3, 4, 1 folds, and check the 2rd fold; lastly, test on the 4,1,2 folds, and then check the 3 fold. Then take the average of the errors (goodness of fit)</h2> </li> <li> <h2>Pick a model: choose the combination with the lowest error, the model class that does the best job, with the lowest error, is our pick(the degree of polynomial )</h2> </li> </ul>","","https://www.youtube.com/watch?v=sFO2ff-gTh0","","","","","","","","","","","","","","","","","","","","","","","","","","","","","","","","","","","","","","","","","","","","","","","",""
"KR6BN8FR","webpage","","","core-methods-in-edm/Syllabus","GitHub","","","","https://github.com/core-methods-in-edm/Syllabus","Syllabus for EDCT GE 2550","","2016-10-19 22:22:41","2016-10-19 22:22:41","2016-10-19 22:22:41","","","","","","","","","","","","","","","","","","","","","","","/Users/jonathanfan/Library/Application Support/Zotero/Profiles/a4d34d3d.default/zotero/storage/DNCPHQW2/Syllabus.html","","","","","","","","","","","","","","","","","","","","","","","","","","","","","","","","","","","","","","","","","","","","","","","","",""
"Q58CBWB8","webpage","","","Index. ggplot2 2.1.0","","","","","http://docs.ggplot2.org/current/","","","2016-10-22 15:44:39","2016-10-22 15:44:39","2016-10-22 15:44:39","","","","","","","","","","","","","","","","","","","","","","","/Users/jonathanfan/Library/Application Support/Zotero/Profiles/a4d34d3d.default/zotero/storage/ECF7IJ7V/current.html","","","","","","","","","","","","","","","","","","","","","","","","","","","","","","","","","","","","","","","","","","","","","","","","",""
"2992U6FJ","webpage","","","China’s plan to organize its society relies on ‘big data’ to rate everyone","Washington Post","","","","https://www.washingtonpost.com/world/asia_pacific/chinas-plan-to-organize-its-whole-society-around-big-data-a-rating-for-everyone/2016/10/20/1cd0dd9c-9516-11e6-ae9d-0030ac1899cd_story.html","The Communist Party wants to harness vast troves of online data to score people and companies on their behavior.","","2016-10-25 15:13:30","2016-10-25 15:13:30","2016-10-25 15:13:30","","","","","","","","","","","","","","","","","","","","","","","/Users/jonathanfan/Library/Application Support/Zotero/Profiles/a4d34d3d.default/zotero/storage/EH3JXH5F/1cd0dd9c-9516-11e6-ae9d-0030ac1899cd_story.html","","","","","","","","","","","","","","","","","","","","","","","","","","","","","","","","","","","","","","","","","","","","","","","","",""
"KFBTATA7","webpage","","","Google Has Quietly Dropped Ban on Personally Identifiable Web Tracking","Common Dreams","","","","http://www.commondreams.org/news/2016/10/23/google-has-quietly-dropped-ban-personally-identifiable-web-tracking","Update, Oct. 21, 2016: After we published this story, Google reached out to say that it doesn’t currently use Gmail keywords to target web ads. We’ve updated the story to reflect that.---When Google bought the advertising network DoubleClick in 2007, Google founder Sergey Brin said that privacy would be the company’s “number one priority when we contemplate new kinds of advertising products.”","","2016-10-25 15:15:18","2016-10-25 15:15:18","2016-10-25 15:15:18","","","","","","","","","","","","","","","","","","","","","","","/Users/jonathanfan/Library/Application Support/Zotero/Profiles/a4d34d3d.default/zotero/storage/3J8XRXKV/google-has-quietly-dropped-ban-personally-identifiable-web-tracking.html","","","","","","","","","","","","","","","","","","","","","","","","","","","","","","","","","","","","","","","","","","","","","","","","",""
"KNG8QBM5","webpage","","","RDocumentation","","","","","https://www.rdocumentation.org/","","","2016-10-25 15:27:44","2016-10-25 15:27:44","2016-10-25 15:27:44","","","","","","","","","","","","","","","","","","","","","","","/Users/jonathanfan/Library/Application Support/Zotero/Profiles/a4d34d3d.default/zotero/storage/5IJX55NG/www.rdocumentation.org.html","","","","","","","","","","","","","","","","","","","","","","","","","","","","","","","","","","","","","","","","","","","","","","","","",""
"U6GMBQAQ","webpage","","","Principal Component Analysis explained visually","Explained Visually","","","","http://setosa.io/ev/principal-component-analysis/","","","2016-10-27 16:11:14","2016-10-27 16:11:14","2016-10-27 16:11:14","","","","","","","","","","","","","","","","","","","","","","","/Users/jonathanfan/Library/Application Support/Zotero/Profiles/a4d34d3d.default/zotero/storage/SE3S6PQI/Principal Component Analysis explained visually.html","","","","","","","","","","","","","","","","","","","","","","","","","","","","","","","","","","","","","","","","","","","","","","","","",""
