"Key","Item Type","Publication Year","Author","Title","Publication Title","ISBN","ISSN","DOI","Url","Abstract Note","Date","Date Added","Date Modified","Access Date","Pages","Num Pages","Issue","Volume","Number Of Volumes","Journal Abbreviation","Short Title","Series","Series Number","Series Text","Series Title","Publisher","Place","Language","Rights","Type","Archive","Archive Location","Library Catalog","Call Number","Extra","Notes","File Attachments","Link Attachments","Manual Tags","Automatic Tags","Editor","Series Editor","Translator","Contributor","Attorney Agent","Book Author","Cast Member","Commenter","Composer","Cosponsor","Counsel","Interviewer","Producer","Recipient","Reviewed Author","Scriptwriter","Words By","Guest","Number","Edition","Running Time","Scale","Medium","Artwork Size","Filing Date","Application Number","Assignee","Issuing Authority","Country","Meeting Name","Conference Name","Court","References","Reporter","Legal Status","Priority Numbers","Programming Language","Version","System","Code","Code Number","Section","Session","Committee","History","Legislative Body"
"ABCD2345","webpage","","Center for History and New Media","Zotero Quick Start Guide","","","","","http://zotero.org/support/quick_start_guide","","","2016-09-12 01:51:41","2016-09-12 01:51:41","","","","","","","","","","","","","","","","","","","","","","","<p><strong>Welcome to Zotero!</strong></p> <p>View the Quick Start Guide to learn how to begin collecting, managing, citing, and sharing your research sources.</p> <p>Thanks for installing Zotero.</p>","","","","","","","","","","","","","","","","","","","","","","","","","","","","","","","","","","","","","","","","","","","","","","","","","",""
"K882K4W2","journalArticle","","","","","","","","","","","2016-09-13 16:09:11","2016-09-13 16:09:11","","","","","","","","","","","","","","","","","","","","","","","","/Users/jonathanfan/Library/Application Support/Zotero/Profiles/a4d34d3d.default/zotero/storage/7QBPGDIK/LAKs reformatting v2.pdf","","","","","","","","","","","","","","","","","","","","","","","","","","","","","","","","","","","","","","","","","","","","","","","","",""
"VVHZ9JFE","journalArticle","2010","Bowers, Alex J.","Analyzing the Longitudinal K-12 Grading Histories of Entire Cohorts of Students: Grades, Data Driven Decision Making, Dropping out and Hierarchical Cluster Analysis","Practical Assessment, Research & Evaluation","","1531-7714","","","School personnel currently lack an effective method to pattern and visually interpret disaggregated achievement data collected on students as a means to help inform decision making. This study, through the examination of longitudinal K-12 teacher assigned grading histories for entire cohorts of students from a school district (n=188), demonstrates a novel application of hierarchical cluster analysis and pattern visualization in which all data points collected on every student in a cohort can be patterned, visualized and interpreted to aid in data driven decision making by teachers and administrators. Additionally, as a proof-of-concept study, overall schooling outcomes, such as student dropout or taking a college entrance exam, are identified from the data patterns and compared to past methods of dropout identification as one example of the usefulness of the method. Hierarchical cluster analysis correctly identified over 80% of the students who dropped out using the entire student grade history patterns from either K-12 or K-8. (Contains 5 figures.)","2010-05","2016-09-13 16:13:40","2016-09-13 16:13:40","2014-09-24 19:31:29","","","7","15","","","Analyzing the Longitudinal K-12 Grading Histories of Entire Cohorts of Students","","","","","","","en","","","","","ERIC","","","<h2>Hierarchical cluster analysis (HCA)</h2> <p>&nbsp;</p> <p>&nbsp;</p>","","http://eric.ed.gov/?id=EJ933686","","data; data analysis; Decision Making; Dropouts; Elementary School Students; Grades (Scholastic); Identification; MULTIVARIATE analysis; School Districts; Secondary School Students","","","","","","","","","","","","","","","","","","","","","","","","","","","","","","","","","","","","","","","","","","","","","",""
"4VF35SS6","journalArticle","2014","Grunspan, Daniel Z.; Wiggins, Benjamin L.; Goodreau, Steven M.","Understanding Classrooms through Social Network Analysis: A Primer for Social Network Analysis in Education Research","CBE-Life Sciences Education","",", 1931-7913","10.1187/cbe.13-08-0162","http://www.lifescied.org/content/13/2/167","Social interactions between students are a major and underexplored part of undergraduate education. Understanding how learning relationships form in undergraduate classrooms, as well as the impacts these relationships have on learning outcomes, can inform educators in unique ways and improve educational reform. Social network analysis (SNA) provides the necessary tool kit for investigating questions involving relational data. We introduce basic concepts in SNA, along with methods for data collection, data processing, and data analysis, using a previously collected example study on an undergraduate biology classroom as a tutorial. We conduct descriptive analyses of the structure of the network of costudying relationships. We explore generative processes that create observed study networks between students and also test for an association between network position and success on exams. We also cover practical issues, such as the unique aspects of human subjects review for network studies. Our aims are to convince readers that using SNA in classroom environments allows rich and informative analyses to take place and to provide some initial tools for doing so, in the process inspiring future educational studies incorporating relational data.","2014-06-20","2016-09-13 16:13:41","2016-09-13 16:13:41","2014-08-20 20:21:46","167-178","","2","13","","CBE Life Sci Educ","Understanding Classrooms through Social Network Analysis","","","","","","","en","","","","","www.lifescied.org","","","<ul> <li> <h2>This paper explore generative processes that create observed study networks between students and also test for an association between students and also test for an association between network position and success on exams.</h2> </li> <li> <h2>relational data</h2> </li> <li> <h2>network types:</h2> </li> <li> <h2>&nbsp;indirected: if student A studies with student B, then we can be certain that student B also studies with student A</h2> </li> <li> <h2>directed network:&nbsp; if student A perceives student B as smart; it does not imply that student B perceives student A as smart</h2> </li> <li> <h2>ties can also be binary or valued</h2> </li> <li> <h2>binary ties represent whether or not a relation exists,&nbsp;while valued ties include additional quantitative information about the relation.</h2> </li> <li> <h2>eg. a binary network of student study relations would indicate whether or not student A studied with student B; while a valued network would include number f hours they studied together</h2> </li> </ul> <ul> <li> <h2>centrality: degree, closeness, betweenness, and eigenvector centrality</h2> </li> <li> <h2>degree centrality represents the total number of connections a node has</h2> </li> <li> <h2>betweenness centrality focuses on whether actors serve as bridges in the shortest paths between two actors</h2> </li> <li> <h2>closeness betweenness focuses on how close one actor is to other actors on average</h2> </li> <li> <h2>network methods: data collection</h2> </li> <li> <h2>data management</h2> </li> <li> <h2>exploratory data analysis</h2> </li> </ul> <p>&nbsp;</p> <p>&nbsp;</p> <p>&nbsp;</p>","","http://www.lifescied.org/content/13/2/167","Week 2","","","","","","","","","","","","","","","","","","","","","","","","","","","","","","","","","","","","","","","","","","","","","","",""
"2P95DCNJ","blogPost","2014","Young, Jeffrey R.","Why Students Should Own Their Educational Data","The Chronicle of Higher Education Blogs: Wired Campus","","","","http://chronicle.com/blogs/wiredcampus/why-students-should-own-their-educational-data/54329","","2014-08-21","2016-09-13 16:13:41","2016-09-13 16:13:41","2014-08-23 21:32:22","","","","","","","","","","","","","","","","","","","","","","<ul> <li><span style=""color: #333333; font-family: Heuristica, 'Times New Roman', Times, serif; font-size: 18px; font-style: normal; font-variant-ligatures: normal; font-variant-caps: normal; font-weight: normal; letter-spacing: normal; orphans: 2; text-align: start; text-indent: 0px; text-transform: none; white-space: normal; widows: 2; word-spacing: 0px; -webkit-text-stroke-width: 0px; background-color: #ffffff; display: inline !important; float: none;"">In a TEDx talk last summer, the professor explained that most learners have a “jagged profile” of traits when it comes to learning. One student might have an affinity for science but have below-average reading skills. Yet standard teaching practice assumes at least average skills across the board. “Because our science textbook assumes every kid is reading on grade level, we’re in trouble,” he said in the talk. “For her, science class is first and foremost a reading test, and it’s doubtful that we will ever see what she’s truly capable of.”</span></li> </ul> <p>&nbsp;</p> <ul> <li> <h2 style=""box-sizing: border-box; margin: 0px 0px 11px; font-size: 18px; line-height: 1.7em; color: #333333; font-family: Heuristica, 'Times New Roman', Times, serif; font-style: normal; font-variant-ligatures: normal; font-variant-caps: normal; font-weight: normal; letter-spacing: normal; orphans: 2; text-align: start; text-indent: 0px; text-transform: none; white-space: normal; widows: 2; word-spacing: 0px; -webkit-text-stroke-width: 0px; background-color: #ffffff;"">Mr. Rose believes that technology can help, by giving educators detailed data on students and the ability to customize teaching materials so “they truly can nurture the potential of every single individual.”</h2> </li> </ul> <ul> <li> <h2 style=""box-sizing: border-box; margin: 0px 0px 11px; font-size: 18px; line-height: 1.7em; color: #333333; font-family: Heuristica, 'Times New Roman', Times, serif; font-style: normal; font-variant-ligatures: normal; font-variant-caps: normal; font-weight: normal; letter-spacing: normal; orphans: 2; text-align: start; text-indent: 0px; text-transform: none; white-space: normal; widows: 2; word-spacing: 0px; -webkit-text-stroke-width: 0px; background-color: #ffffff;"">To make his case, Mr. Rose created a nonprofit organization called<span class=""Apple-converted-space"">&nbsp;</span><a style=""box-sizing: border-box; background-color: transparent; color: #007aad; text-decoration: none;"" href=""http://www.projectvariability.org/"">Center for Individual Opportunity </a>(formerly Project Variability), which has supported research on what he calls the “science of the individual.”</h2> </li> </ul> <p>&nbsp;</p>","","http://chronicle.com/blogs/wiredcampus/why-students-should-own-their-educational-data/54329","","","","","","","","","","","","","","","","","","","","","","","","","","","","","","","","","","","","","","","","","","","","","","","",""
"R3MMUCT3","journalArticle","1994","Corbett, Albert T.; Anderson, John R.","Knowledge tracing: Modeling the acquisition of procedural knowledge","User Modeling and User-Adapted Interaction","","0924-1868, 1573-1391","10.1007/BF01099821","http://liris.cnrs.fr/~pchampin/2014/m2iade-ia2/slides/_static/893CorbettAnderson1995.pdf","This paper describes an effort to model students' changing knowledge state during skill acquisition. Students in this research are learning to write short programs with the ACT Programming Tutor (APT). APT is constructed around a production rule cognitive model of programming knowledge, called theideal student model. This model allows the tutor to solve exercises along with the student and provide assistance as necessary. As the student works, the tutor also maintains an estimate of the probability that the student has learned each of the rules in the ideal model, in a process calledknowledge tracing. The tutor presents an individualized sequence of exercises to the student based on these probability estimates until the student has ‘mastered’ each rule. The programming tutor, cognitive model and learning and performance assumptions are described. A series of studies is reviewed that examine the empirical validity of knowledge tracing and has led to modifications in the process. Currently the model is quite successful in predicting test performance. Further modifications in the modeling process are discussed that may improve performance levels.","1994-12-01","2016-09-13 16:13:41","2016-12-18 03:18:15","2013-04-21 21:21:19","253-278","","4","4","","User Model User-Adap Inter","Knowledge tracing","","","","","","","en","","","","","link.springer.com.ezp-prod1.hul.harvard.edu","","","<h2>Class notes:</h2> <h2>Teaching Machines</h2> <h2>2 sigma problem</h2> <h2>intelligent tutoring systems</h2> <h2>dragonbox (math, tracer strategy)</h2> <h2>knowledge tracer</h2> <h2>BKT</h2> <h2>skills is tightly defined</h2> <h2>best estimate at that moment</h2> <h2>assumptions:</h2> <h2>skills are either learned or unlearned</h2> <h2>Latent trait model</h2> <p>&nbsp;</p> <p>&nbsp;</p>","","","","Education (general); empirical validity; individual differences; intelligent tutoring systems; Learning; Management of Computing and Information Systems; mastery learning; Multimedia Information Systems; procedural knowledge; Psychology, general; student modeling; User Interfaces and Human Computer Interaction","","","","","","","","","","","","","","","","","","","","","","","","","","","","","","","","","","","","","","","","","","","","","",""
"2HG28Q2I","conferencePaper","2012","Siemens, George; Baker, Ryan S. J. d.","Learning Analytics and Educational Data Mining: Towards Communication and Collaboration","Proceedings of the 2Nd International Conference on Learning Analytics and Knowledge","978-1-4503-1111-3","","10.1145/2330601.2330661","http://doi.acm.org/10.1145/2330601.2330661","Growing interest in data and analytics in education, teaching, and learning raises the priority for increased, high-quality research into the models, methods, technologies, and impact of analytics. Two research communities -- Educational Data Mining (EDM) and Learning Analytics and Knowledge (LAK) have developed separately to address this need. This paper argues for increased and formal communication and collaboration between these communities in order to share research, methods, and tools for data mining and analysis in the service of developing both LAK and EDM fields.","2012","2016-09-13 16:13:41","2016-09-13 16:13:41","2015-01-16 03:15:55","252–254","","","","","","Learning Analytics and Educational Data Mining","","","","","ACM","New York, NY, USA","","","","","","ACM Digital Library","","","<ul> <li> <h2>Differences between learning analytics and EDM</h2> </li> <li> <h2>EDM is an emerging discipline, concerned with developing methods for exploring the unique types of data that come from educational settings, and using those methods to better understand students, and settings which they learn in</h2> </li> <li> <h2>LA: the measurement, collection, analysis and reporting of data about learners and their contexts, for purposes of understanding and optimizing learning and the environments in which it occurs.</h2> </li> <li> <h2>Similarities: the goal of improving education by improving assessment, how interventions are planned and selected</h2> </li> <li> <h2>Key differences: LA: leveraging human judgement is key; stronger emphasis on understanding systems as wholes; methods including SNA, sentiment analysis, influence analysis, discourse analysis, learner success prediction; domains are MOOCs, game design, learning sciences</h2> </li> <li> <h2><br />EDM: automated discovery is key; stronger emphasis on reducing to components and analyzing individual components and relationships between them; methods including classification, clustering, bayesian modeling, relationship mining, visualization; domains are intelligent tutoring</h2> </li> </ul>","/Users/jonathanfan/Library/Application Support/Zotero/Profiles/a4d34d3d.default/zotero/storage/SMTDJTGU/LAKs reformatting v2.pdf","","","Collaboration; educational data mining; learning analytics and knowledge","","","","","","","","","","","","","","","","","","","","","","","","","","","","","","","","","","","","","","","","","","","","","",""
"C7M7QQNS","journalArticle","2008","Baker, Ryan S. J. d; Corbett, Albert T.; Roll, Ido; Koedinger, Kenneth R.","Developing a generalizable detector of when students game the system","User Modeling and User-Adapted Interaction","","0924-1868, 1573-1391","10.1007/s11257-007-9045-6","http://link.springer.com.ezp-prod1.hul.harvard.edu/article/10.1007/s11257-007-9045-6","Some students, when working in interactive learning environments, attempt to “game the system”, attempting to succeed in the environment by exploiting properties of the system rather than by learning the material and trying to use that knowledge to answer correctly. In this paper, we present a system that can accurately detect whether a student is gaming the system, within a Cognitive Tutor mathematics curricula. Our detector also distinguishes between two distinct types of gaming which are associated with different learning outcomes. We explore this detector’s generalizability, and find that it transfers successfully to both new students and new tutor lessons.","2008-08-01","2016-09-13 16:13:41","2016-09-13 16:13:41","2015-01-16 16:33:56","287-314","","3","18","","User Model User-Adap Inter","","","","","","","","en","","","","","link.springer.com.ezp-prod1.hul.harvard.edu","","","","","http://link.springer.com.ezp-prod1.hul.harvard.edu/article/10.1007/s11257-007-9045-6","","Behavior detection; Cognitive tutors; Education (general); Gaming the system; Generalizable models; Interactive learning environments; Latent response models; Machine learning; Management of Computing and Information Systems; Multimedia Information Systems; student modeling; User Interfaces and Human Computer Interaction","","","","","","","","","","","","","","","","","","","","","","","","","","","","","","","","","","","","","","","","","","","","","",""
