"K465U99A","blogPost","2015","Leong, B; Polonetsky, J","Why Opting Out of Student Data Collection Isn’t the Solution","EdSurge","","","","https://www.edsurge.com/news/2015-03-16-why-opting-out-of-student-data-collection-isn-t-the-solution","In every privacy debate across every industry, the same questions arise about the rights of individuals to “opt-out” of their data being collected or used. So it should come as no surprise that the “when” and “how” of parent and student opt-outs of education data collection or use has become a robust","2015-03-16","2016-09-13 16:13:41","2016-09-13 16:13:41","2016-01-16 16:31:25","","","","","","","","","","","","","","","","","","","","","","<ul> <li> <h2><span style=""color: #545e68; font-family: 'Work Sans', -apple-system, BlinkMacSystemFont, 'Segoe UI', Roboto, Helvetica, Arial, sans-serif; font-size: 20px; font-style: normal; font-variant-ligatures: normal; font-variant-caps: normal; font-weight: normal; letter-spacing: normal; orphans: 2; text-align: start; text-indent: 0px; text-transform: none; white-space: normal; widows: 2; word-spacing: 0px; -webkit-text-stroke-width: 0px; display: inline !important; float: none;"">Opt-out rights should be an opportunity for parents to decline uses of data that truly are secondary to the functioning of our educational system – not an opportunity to avoid resolution of education policy issues that affect all students.</span></h2> </li> <li> <h2>Some primary use of data:</h2> </li> <li> <h2 class=""md-mx-auto sm-col-8 md-col-6 px3 postContentBlock-root"" style=""box-sizing: border-box; padding-left: 0.75rem; padding-right: 0.75rem; width: 596.5px; margin-right: auto; margin-left: auto; color: #545e68; font-family: 'Work Sans',-apple-system,BlinkMacSystemFont,'Segoe UI',Roboto,Helvetica,Arial,sans-serif; font-size: 16px; font-style: normal; font-variant-ligatures: normal; font-variant-caps: normal; font-weight: normal; letter-spacing: normal; text-align: left; text-indent: 0px; text-transform: none; white-space: normal; word-spacing: 0px; -webkit-text-stroke-width: 0px;"">&nbsp;In order for schools to function, they need basic information about students and parents. They need to record grades, know who is eligible for subsidized lunch, and who has special learning needs. Schools need to share data with vendors who operate cafeterias, school buses, and data storage systems for the school.</h2> </li> <li> <h2 class=""md-mx-auto sm-col-8 md-col-6 px3 postContentBlock-root"" style=""box-sizing: border-box; padding-left: 0.75rem; padding-right: 0.75rem; width: 596.5px; margin-right: auto; margin-left: auto; color: #545e68; font-family: 'Work Sans',-apple-system,BlinkMacSystemFont,'Segoe UI',Roboto,Helvetica,Arial,sans-serif; font-size: 16px; font-style: normal; font-variant-ligatures: normal; font-variant-caps: normal; font-weight: normal; letter-spacing: normal; text-align: left; text-indent: 0px; text-transform: none; white-space: normal; word-spacing: 0px; -webkit-text-stroke-width: 0px;"">In general, we might think about administrative and educational purposes as primary purposes of a school system where data collection is necessary, expected, and where it is not feasible to provide parents with choices because to do so would prevent the school from providing students with basic school educational services.</h2> </li> <li> <h2>Then, there is the use of data to understand how well students perform over time, how well a school system is serving different populations, and how well different educational strategies are succeeding.</h2> </li> </ul>","","https://www.edsurge.com/news/2015-03-16-why-opting-out-of-student-data-collection-isn-t-the-solution","","","","","","","","","","","","","","","","","","","","","","","","","","","","","","","","","","","","","","","","","","","","","","","",""
"IQISV96J","videoRecording","2015","Educause","Why Is Measuring Learning So Difficult?","","","","","https://www.youtube.com/watch?v=_iv8A1pHNYA","Several higher education learning and assessment professionals discuss the difficulties of measuring learning.","2015-08-17","2016-09-13 16:13:41","2016-09-13 16:13:41","2016-01-17 18:50:57","","","","","","","","","","","","","","","","","","","YouTube","","","<h2>Why is Measuring Learning So Difficult?</h2> <ul> <li> <h2>learning is the most multidimensional learning thing, sometimes people try to simplify it too much in order to capture data and understanding of it, which is the problem of measurement</h2> </li> <li> <h2>&nbsp;learning is too broad, too contextual, the knowledge is so contextual-based, which is hard to measure</h2> </li> <li> <h2>Learning is a very personal thing; the construct of learning as a cultural construct, difficult to define and measure; hard to observe and measure the changes inside the brain after learning, but can observe one's behavior as a result</h2> </li> <li> <h2>what is measure? hard to find a reliable simple proxy indicator of learning; no indicator we can trust; learning is about curiosity and memory; ""understanding"" can be an indicator of learning, such as students teach to each other</h2> </li> <li> <h2>social and cultural implications</h2> </li> <li> <h2>People's ability to assess any kind of competency is a problem; MOOCS: competency (related to their prior knowledge and experience, for instance a PHD physics student would not learn if he take the intro physics course on MOOCS); new tool of assess learning: like assess learning at multiple time points</h2> </li> <li> <h2>connected learning, learning analytics should a doorway to suggest what else is possible</h2> </li> </ul>","","","","Assessment; Education; educational assessment; EDUCAUSE; Higher Education; learners; Learning; Teaching and learning","","","","","","","","","","","","","","","","","","","","","470 seconds","","","","","","","","","","","","","","","","","","","","","","","","",""
"9VS4DQM6","webpage","2016","Weinersmith, Zach","Saturday Morning Breakfast Cereal","","","","","http://www.smbc-comics.com/index.php?id=3978","","2016-01-05","2016-09-13 16:13:41","2016-09-13 16:13:41","2016-01-18 18:17:09","","","","","","","","","","","","","","","","","","","","","","<h2>people get fixated on one thing and ignore everything else</h2>","","http://www.smbc-comics.com/index.php?id=3978","","","","","","","","","","","","","","","","","","","","","","","","","","","","","","","","","","","","","","","","","","","","","","","",""
"CSZFGVPH","conferencePaper","2014","Clow, Doug","Data wranglers: human interpreters to help close the feedback loop","Proceedings of the Fourth International Conference on Learning Analytics And Knowledge","","","","","","2014","2016-09-13 16:13:41","2016-09-13 16:13:41","","49–53","","","","","","","","","","","ACM","","","","","","","","","","<ul> <li> <h2>This paper describes a program of activity, where a group of ""Data Wranglers"" were deployed to engage in sense-making activity with learning analytics data. The immediate goal was producing reports with actionable recommendations, and the overall aim was to drive systematic improvement through single and double -loop learning.</h2> </li> </ul>","","","","","","","","","","","","","","","","","","","","","","","","","","","","","","","","","","","","","","","","","","","","","","","","","",""
"72PUB2CN","magazineArticle","2015","Kucirkova, Natalia; FitzGerald, Elizabeth","Zuckerberg is ploughing billions into 'personalised learning' – why?","The Conversation","","","","http://theconversation.com/zuckerberg-is-ploughing-billions-into-personalised-learning-why-51940","Zuckerburg wants to plough billions into personalised learning, but his way may not be the right way.","2015-12-09","2016-09-13 16:13:41","2016-09-13 16:13:41","2016-01-18 19:14:05","","","","","","","","","","","","","","","","","","","","","","<h2><span style=""color: #000000;""><strong>Three major flaws of personalized learning:</strong></span></h2> <ul> <li> <h2><span style=""color: #000000;"">By feeding children only the content they' re interested in, we may end up with many specialists and few generalists.</span></h2> </li> </ul> <ul> <li> <h2><span style=""color: #000000;""><span style=""font-family: 'Libre Baskerville',Georgia,Times,'Times New Roman',serif; font-size: 16px; font-style: normal; font-variant-ligatures: normal; font-variant-caps: normal; letter-spacing: normal; text-align: start; text-indent: 0px; text-transform: none; white-space: normal; word-spacing: 0px; background-color: #ffffff; display: inline ! important; float: none;"">Second, while learners may cope poorly with trying to learn in a way that’s not suited to them, in the real world life will not always be so accommodating.</span> Their lack of ability to compensate may mean they suffer as a result.</span></h2> </li> </ul> <ul> <li> <h2><span style=""color: #000000;""><span style=""font-family: 'Libre Baskerville',Georgia,Times,'Times New Roman',serif; font-size: 16px; font-style: normal; font-variant-ligatures: normal; font-variant-caps: normal; letter-spacing: normal; text-align: start; text-indent: 0px; text-transform: none; white-space: normal; word-spacing: 0px; background-color: #ffffff; display: inline ! important; float: none;"">Finally, children’s preferences are not fixed – in fact they often change as immediate responses to the environment.<span class=""Apple-converted-space"">&nbsp;</span></span>the risk is that the valuable social contact between students</span></h2> </li> <li> <h2><span style=""color: #000000;""><span style=""color: #383838; font-family: 'Libre Baskerville',Georgia,Times,'Times New Roman',serif; font-size: 16px; font-style: normal; font-variant-ligatures: normal; font-variant-caps: normal; letter-spacing: normal; text-align: start; text-indent: 0px; text-transform: none; white-space: normal; word-spacing: 0px; background-color: #ffffff; display: inline ! important; float: none;"">There is also the issue of ensuring that children’s data is not misused. Recording children’s personal progress, preferences and needs poses a privacy risk if it is not managed properly.<span class=""Apple-converted-space"">&nbsp;</span></span></span></h2> </li> <li> <h2><span style=""color: #000000;""><span style=""color: #383838; font-family: 'Libre Baskerville',Georgia,Times,'Times New Roman',serif; font-size: 16px; font-style: normal; font-variant-ligatures: normal; font-variant-caps: normal; letter-spacing: normal; text-align: start; text-indent: 0px; text-transform: none; white-space: normal; word-spacing: 0px; background-color: #ffffff; display: inline ! important; float: none;""><span class=""Apple-converted-space""><strong>Application:</strong> <strong>Altschool</strong>: but don't know how well it works <br /></span></span></span></h2> </li> <li> <h2><span style=""color: #000000;""><span style=""color: #383838; font-family: 'Libre Baskerville',Georgia,Times,'Times New Roman',serif; font-size: 16px; font-style: normal; font-variant-ligatures: normal; font-variant-caps: normal; letter-spacing: normal; text-align: start; text-indent: 0px; text-transform: none; white-space: normal; word-spacing: 0px; background-color: #ffffff; display: inline ! important; float: none;""><span class=""Apple-converted-space""><strong>A compromise approach</strong>: McGraw Hill allows educators to choose between the adaptive or customized study plans<br /></span></span></span></h2> </li> <li> <h2><span style=""color: #000000;""><span style=""color: #383838; font-family: 'Libre Baskerville',Georgia,Times,'Times New Roman',serif; font-size: 16px; font-style: normal; font-variant-ligatures: normal; font-variant-caps: normal; letter-spacing: normal; text-align: start; text-indent: 0px; text-transform: none; white-space: normal; word-spacing: 0px; background-color: #ffffff; display: inline ! important; float: none;""><span class=""Apple-converted-space"">personalized learning combined with emotional analytics , personal inquiry, dynamic and stealth assessment could be a very powerful tool.</span></span></span></h2> </li> </ul>","","","","","","","","","","","","","","","","","","","","","","","","","","","","","","","","","","","","","","","","","","","","","","","","","",""
"WH4C8DEM","videoRecording","2015","Georgia Tech","Feature Selection","","","","","https://www.youtube.com/watch?v=8CpRLplmdqE","","2015-02-23","2016-09-13 16:13:41","2016-09-13 16:13:41","2016-01-18 19:18:06","","","","","","","","","","","","Youtube","","","","","","","","","","<ul> <li> <h2>Feature Selection</h2> </li> <li> <h2>knowledge discovery</h2> </li> <li> <h2>interpretability and insight</h2> </li> <li> <h2>curse of dimensionality: as add more features, need more exponetially more data to fill out the space; the amount of data that you need grows exponentially in the number of the feature that you have</h2> </li> <li> <h2>it is nice to have fewer features</h2> </li> </ul>","","https://www.youtube.com/watch?v=8CpRLplmdqE","","","","","","","","","","","","","","","Udacity","","","","","","","","3:13","","","","","","","","","","","","","","","","","","","","","","","","",""
"JUTV6XWM","bookSection","2016","Hanneman, R.A.; Riddle, M.","Chapter 1: Social Network Data","Introduction to Social Network Methods","","","","http://faculty.ucr.edu/~hanneman/nettext/C1_Social_Network_Data.html","","2016-01-18","2016-09-13 16:13:41","2016-09-13 16:13:41","2016-01-18 20:17:24","","","","","","","","","","","","","","","","","","","","","","<ul> <li><span style=""color: #000000; font-family: Arial; font-size: medium; font-style: normal; font-variant-ligatures: normal; font-variant-caps: normal; font-weight: normal; letter-spacing: normal; orphans: 2; text-align: start; text-indent: 0px; text-transform: none; white-space: normal; widows: 2; word-spacing: 0px; -webkit-text-stroke-width: 0px; background-color: #ffffff; display: inline !important; float: none;"">Social network analysts rarely draw samples in their work. Most commonly, network analysts will identify some population and conduct a census (i.e. include all elements of the population as units of observation). A network analyst might examine all of the nouns and objects occurring in a text, all of the persons at a birthday party, all members of a kinship group, of an organization, neighborhood, or social class (e.g. landowners in a region, or royalty).</span></li> <li><span style=""color: #000000; font-family: Arial; font-size: medium; font-style: normal; font-variant-ligatures: normal; font-variant-caps: normal; font-weight: normal; letter-spacing: normal; orphans: 2; text-align: start; text-indent: 0px; text-transform: none; white-space: normal; widows: 2; word-spacing: 0px; -webkit-text-stroke-width: 0px; background-color: #ffffff; display: inline !important; float: none;""><span style=""color: #000000; font-family: Arial; font-size: medium; font-style: normal; font-variant-ligatures: normal; font-variant-caps: normal; font-weight: normal; letter-spacing: normal; orphans: 2; text-align: start; text-indent: 0px; text-transform: none; white-space: normal; widows: 2; word-spacing: 0px; -webkit-text-stroke-width: 0px; background-color: #ffffff; display: inline !important; float: none;"">The network analyst tends to see individual people nested within networks of face-to-face relations with other persons. Often these networks of interpersonal relations become ""social facts"" and take on a life of their own. A family, for example, is a network of close relations among a set of people. But this particular network has been institutionalized and given a name and reality beyond that of its component nodes. Individuals in their work relations may be seen as nested within organizations; in their leisure relations they may be nested in voluntary associations. Neighborhoods, communities, and even societies are, to varying degrees, social entities in and of themselves. And, as social entities, they may form ties with the individuals nested within them, and with other social entities.</span></span></li> </ul>","","http://faculty.ucr.edu/~hanneman/nettext/C1_Social_Network_Data.html","","","","","","","","","","","","","","","","","","","","","","","","","","","","","","","","","","","","","","","","","","","","","","","",""
"43QM4GFU","webpage","2014","Groelmund, Garrett","RStudio Cheat Sheets","RStudio","","","","https://www.rstudio.com/resources/cheatsheets/","","2014-08-01","2016-09-13 16:13:41","2016-09-13 16:13:41","2016-01-19 21:17:28","","","","","","","","","","","","","","","","","","","","","","<h2>R Cheatsheet</h2> <ul> <li> <h2>I always refer to the data wrangling cheatsheet. I learned about the how to reshape the date using function in the package of ""tidyr"", such as ""spread"" and ""gather,"" these two functions are hard to visualized though I used them more than once.</h2> </li> </ul> <ul> <li> <h2>Besides these two functions, I also used ""unite"" when I try to unitseveral columns into one in the clustering assignment</h2> </li> <li> <h2>I would say ""select"" is the function I used frequently, since in some projects, I always need to select out one or multiple columns</h2> </li> <li> <h2>I like the function of ""slice,"" since it can select rows by position and my preference</h2> </li> <li> <h2>For future projects, I would like to use more of the ""group_by"", and make sense of the ""window"" function</h2> </li> <li> <h2>Also, I really want to know more of the ""ggplot2"", which is powerful! (based on its cheatsheet)</h2> </li> </ul> <p>&nbsp;</p> <p>&nbsp;</p>","","http://shiny.rstudio.com/articles/rm-cheatsheet.html","","","","","","","","","","","","","","","","","","","","","","","","","","","","","","","","","","","","","","","","","","","","","","","",""
"4FAFWSVQ","conferencePaper","2013","san Pedro, Maria Ofelia; Baker, Ryan; Bowers, Alex; Heffernan, Neil","Predicting college enrollment from student interaction with an intelligent tutoring system in middle school","Educational Data Mining 2013","","","","","","2013","2016-09-13 16:13:41","2016-09-13 16:13:41","","","","","","","","","","","","","","","","","","","","","","","<ul> <li> <h2><span style=""color: #242729; font-family: Georgia, 'Times New Roman', Times, serif; font-size: 15px; font-style: normal; font-variant-ligatures: normal; font-variant-caps: normal; font-weight: normal; letter-spacing: normal; orphans: 2; text-align: left; text-indent: 0px; text-transform: none; white-space: normal; widows: 2; word-spacing: 0px; -webkit-text-stroke-width: 0px; background-color: #fefefe; display: inline !important; float: none;"">Differences between regression and classification:</span></h2> </li> </ul> <h2><span style=""color: #242729; font-family: Georgia, 'Times New Roman', Times, serif; font-size: 15px; font-style: normal; font-variant-ligatures: normal; font-variant-caps: normal; font-weight: normal; letter-spacing: normal; orphans: 2; text-align: left; text-indent: 0px; text-transform: none; white-space: normal; widows: 2; word-spacing: 0px; -webkit-text-stroke-width: 0px; background-color: #fefefe; display: inline !important; float: none;"">Regression involves estimating or predicting a response. Classification is identifying group membership.</span></h2> <h2><span style=""color: #242729; font-family: Georgia, 'Times New Roman', Times, serif; font-size: 15px; font-style: normal; font-variant-ligatures: normal; font-variant-caps: normal; font-weight: normal; letter-spacing: normal; orphans: 2; text-align: left; text-indent: 0px; text-transform: none; white-space: normal; widows: 2; word-spacing: 0px; -webkit-text-stroke-width: 0px; background-color: #fefefe; display: inline !important; float: none;""><span style=""color: #333333; font-family: Georgia, Times, 'Times New Roman', serif; font-size: 15px; font-style: normal; font-variant-ligatures: normal; font-variant-caps: normal; font-weight: normal; letter-spacing: normal; orphans: 2; text-align: start; text-indent: 0px; text-transform: none; white-space: normal; widows: 2; word-spacing: 0px; -webkit-text-stroke-width: 0px; display: inline !important; float: none;"">Regression is used to predict<span class=""Apple-converted-space"">&nbsp;</span></span><strong style=""font-weight: bold; margin-top: 0px; color: #333333; font-family: Georgia, Times, 'Times New Roman', serif; font-size: 15px; font-style: normal; font-variant-ligatures: normal; font-variant-caps: normal; letter-spacing: normal; orphans: 2; text-align: start; text-indent: 0px; text-transform: none; white-space: normal; widows: 2; word-spacing: 0px; -webkit-text-stroke-width: 0px;"">continuous values</strong><span style=""color: #333333; font-family: Georgia, Times, 'Times New Roman', serif; font-size: 15px; font-style: normal; font-variant-ligatures: normal; font-variant-caps: normal; font-weight: normal; letter-spacing: normal; orphans: 2; text-align: start; text-indent: 0px; text-transform: none; white-space: normal; widows: 2; word-spacing: 0px; -webkit-text-stroke-width: 0px; display: inline !important; float: none;"">. Classification is used to predict which class a data point is part of (</span><strong style=""font-weight: bold; color: #333333; font-family: Georgia, Times, 'Times New Roman', serif; font-size: 15px; font-style: normal; font-variant-ligatures: normal; font-variant-caps: normal; letter-spacing: normal; orphans: 2; text-align: start; text-indent: 0px; text-transform: none; white-space: normal; widows: 2; word-spacing: 0px; -webkit-text-stroke-width: 0px;"">discrete value</strong><span style=""color: #333333; font-family: Georgia, Times, 'Times New Roman', serif; font-size: 15px; font-style: normal; font-variant-ligatures: normal; font-variant-caps: normal; font-weight: normal; letter-spacing: normal; orphans: 2; text-align: start; text-indent: 0px; text-transform: none; white-space: normal; widows: 2; word-spacing: 0px; -webkit-text-stroke-width: 0px; display: inline !important; float: none;"">).<span class=""Apple-converted-space""> <br /></span></span></span></h2> <h2><span style=""color: #242729; font-family: Georgia, 'Times New Roman', Times, serif; font-size: 15px; font-style: normal; font-variant-ligatures: normal; font-variant-caps: normal; font-weight: normal; letter-spacing: normal; orphans: 2; text-align: left; text-indent: 0px; text-transform: none; white-space: normal; widows: 2; word-spacing: 0px; -webkit-text-stroke-width: 0px; background-color: #fefefe; display: inline !important; float: none;""><span style=""color: #333333; font-family: Georgia, Times, 'Times New Roman', serif; font-size: 15px; font-style: normal; font-variant-ligatures: normal; font-variant-caps: normal; font-weight: normal; letter-spacing: normal; orphans: 2; text-align: start; text-indent: 0px; text-transform: none; white-space: normal; widows: 2; word-spacing: 0px; -webkit-text-stroke-width: 0px; display: inline !important; float: none;""><span class=""Apple-converted-space"">A great concept map of regression, classification, clustering and dimension reduction:</span></span></span></h2> <h2><span style=""color: #242729; font-family: Georgia, 'Times New Roman', Times, serif; font-size: 15px; font-style: normal; font-variant-ligatures: normal; font-variant-caps: normal; font-weight: normal; letter-spacing: normal; orphans: 2; text-align: left; text-indent: 0px; text-transform: none; white-space: normal; widows: 2; word-spacing: 0px; -webkit-text-stroke-width: 0px; background-color: #fefefe; display: inline !important; float: none;""><span style=""color: #333333; font-family: Georgia, Times, 'Times New Roman', serif; font-size: 15px; font-style: normal; font-variant-ligatures: normal; font-variant-caps: normal; font-weight: normal; letter-spacing: normal; orphans: 2; text-align: start; text-indent: 0px; text-transform: none; white-space: normal; widows: 2; word-spacing: 0px; -webkit-text-stroke-width: 0px; display: inline !important; float: none;""><span class=""Apple-converted-space"">https://qph.ec.quoracdn.net/main-qimg-d8d479d57d050e32c1d77bb859d61ce2?convert_to_webp=true</span></span></span></h2>","","","","","","","","","","","","","","","","","","","","","","","","","","","","","","","","","","","","","","","","","","","","","","","","","",""
